Type,Question,Options,Answer,Chunk_ID,QA_ID
MCQ,Which of the following is the correct syntax to create a function with variable-length keyword arguments?,def display_all(kwargs);def display_all(**kwargs),['def display_all(**kwargs)'],SA_P1_M1_Ch06_Pg086_1,SA_P1_M1_Q285
MCQ,What is the purpose of the return statement in a function?,To return a value from the function;To terminate the execution of the function,['To return a value from the function'],SA_P1_M1_Ch06_Pg086_1,SA_P1_M1_Q286
True/False,The **kwargs parameter is only available in Python 3.,True;False,FALSE,SA_P1_M1_Ch06_Pg086_1,SA_P1_M1_Q287
True/False,A function can return multiple values.,True;False,FALSE,SA_P1_M1_Ch06_Pg086_1,SA_P1_M1_Q288
Blanks,"Functions defined without a name, are known as _____ functions.",,['Anonymous'],SA_P1_M1_Ch06_Pg088_1,SA_P1_M1_Q289
Blanks,The keyword used to define anonymous functions is _____ .,,['lambda'],SA_P1_M1_Ch06_Pg088_1,SA_P1_M1_Q290
Blanks,A lambda function can have only one _____ .,,['expression'],SA_P1_M1_Ch06_Pg088_1,SA_P1_M1_Q291
Match,Lambda function,A function defined without a name.;A function that takes any number of arguments.,A function that takes any number of arguments.,SA_P1_M1_Ch06_Pg088_1,SA_P1_M1_Q292
Match,Anonymous function,A function defined without a name.;A function that takes any number of arguments.,A function defined without a name.,SA_P1_M1_Ch06_Pg088_1,SA_P1_M1_Q293
True/False,Lambda functions can have multiple expressions.,True;False,FALSE,SA_P1_M1_Ch06_Pg088_1,SA_P1_M1_Q294
True/False,Anonymous functions are defined using the 'lambda' keyword.,True;False,TRUE,SA_P1_M1_Ch06_Pg088_1,SA_P1_M1_Q295
Blanks,"Any real world entity is called an _____ such as Employee, Student, Book and more",,object,SA_P1_M1_Ch07_Pg090_1,SA_P1_M1_Q296
Blanks, In programming terms a class is a user defined data type which contains related variable(_____) and methods(_____) together,,"['attributes', 'functionalities']",SA_P1_M1_Ch07_Pg090_1,SA_P1_M1_Q297
Blanks, The main advantage of classes and objects is _____ programming and code _____,,"['object centric', 'reuse']",SA_P1_M1_Ch07_Pg090_1,SA_P1_M1_Q298
Match,Class,A variable within a class;A blueprint of an object;A function within a class;A real world entity,A blueprint of an object,SA_P1_M1_Ch07_Pg090_1,SA_P1_M1_Q299
Match,Object,A real world entity;A blueprint of an object;A variable within a class;A function within a class,A real world entity,SA_P1_M1_Ch07_Pg090_1,SA_P1_M1_Q300
Match,Attribute,A function within a class;A blueprint of an object;A variable within a class;A real world entity,A variable within a class,SA_P1_M1_Ch07_Pg090_1,SA_P1_M1_Q301
Match,Method,A real world entity;A variable within a class;A function within a class;A blueprint of an object,A function within a class,SA_P1_M1_Ch07_Pg090_1,SA_P1_M1_Q302
MCQ,Which of the following is NOT an advantage of object-oriented programming?,Modularity;Code reuse;Encapsulation;Increased complexity,Increased complexity,SA_P1_M1_Ch07_Pg090_1,SA_P1_M1_Q303
MCQ,What is the purpose of the self parameter in a method?,To return the result of the method;To define the type of the object;To pass arguments to the method;To refer to the current object,To refer to the current object,SA_P1_M1_Ch07_Pg090_1,SA_P1_M1_Q304
True/False,Classes and objects are the same thing.,True;False,FALSE,SA_P1_M1_Ch07_Pg090_1,SA_P1_M1_Q305
True/False,"In Python, the class name must start with a lowercase letter.",True;False,FALSE,SA_P1_M1_Ch07_Pg090_1,SA_P1_M1_Q306
Blanks,"To create an object, we use the syntax _________________",,obj_var = class_name(),SA_P1_M1_Ch07_Pg093_1,SA_P1_M1_Q307
Blanks,The ________________ method is called automatically when an object is created.,,__init__(),SA_P1_M1_Ch07_Pg093_1,SA_P1_M1_Q308
Match,class,A blueprint for creating objects;Special method for initializing properties while creating an object;Instance of a class,A blueprint for creating objects,SA_P1_M1_Ch07_Pg093_1,SA_P1_M1_Q309
Match,object,Instance of a class;A blueprint for creating objects;Special method for initializing properties while creating an object,Instance of a class,SA_P1_M1_Ch07_Pg093_1,SA_P1_M1_Q310
Match,initializer,Special method for initializing properties while creating an object;Instance of a class;A blueprint for creating objects,Special method for initializing properties while creating an object,SA_P1_M1_Ch07_Pg093_1,SA_P1_M1_Q311
MCQ,Which of the following is the correct syntax for creating an object in Python?,obj_var = class_name();obj_var = class_name.;obj_var = Class_name,obj_var = class_name(),SA_P1_M1_Ch07_Pg093_1,SA_P1_M1_Q312
MCQ,What is the purpose of an initializer method in Python?,To define the behavior of an object;To set initial values for object properties;To check if an object is valid,To set initial values for object properties,SA_P1_M1_Ch07_Pg093_1,SA_P1_M1_Q313
True/False,Objects are created using the __init__() method.,True;False,FALSE,SA_P1_M1_Ch07_Pg093_1,SA_P1_M1_Q314
True/False,Initializers can only be defined once in a class.,True;False,TRUE,SA_P1_M1_Ch07_Pg093_1,SA_P1_M1_Q315
Blanks,Inheritance is used to _____________ properties from existing class to the new class.,,['Extending'],SA_P1_M1_Ch07_Pg096_1,SA_P1_M1_Q316
Blanks,The main use of inheritance is _____________,,['code reuse'],SA_P1_M1_Ch07_Pg096_1,SA_P1_M1_Q317
Blanks,Three types of inheritance are: _____________,,"['Simple', 'Hierarchical', 'Multilevel']",SA_P1_M1_Ch07_Pg096_1,SA_P1_M1_Q318
Blanks,One benefit of inheritance is _____________,,['Less code repetition'],SA_P1_M1_Ch07_Pg096_1,SA_P1_M1_Q319
Match,Inheritance,A class inherits from a single parent class.;A class inherits from multiple parent classes.;Extending properties from existing class to the new class,Extending properties from existing class to the new class,SA_P1_M1_Ch07_Pg096_1,SA_P1_M1_Q320
Match,Simple,A class inherits from a single parent class.;Extending properties from existing class to the new class;A class inherits from multiple parent classes.,A class inherits from a single parent class.,SA_P1_M1_Ch07_Pg096_1,SA_P1_M1_Q321
Match,Hierarchical,A class inherits from multiple parent classes.;Extending properties from existing class to the new class;A class inherits from a single parent class.,A class inherits from multiple parent classes.,SA_P1_M1_Ch07_Pg096_1,SA_P1_M1_Q322
MCQ,Which of the following is NOT a type of inheritance?,Polymorphism;Hierarchical;Simple;Multilevel,['Polymorphism'],SA_P1_M1_Ch07_Pg096_1,SA_P1_M1_Q323
MCQ,What is a benefit of Python inheritance?,All of the above;Structured code;Code reuse;Scalability,['All of the above'],SA_P1_M1_Ch07_Pg096_1,SA_P1_M1_Q324
True/False,Inheritance is a way to create new classes without any existing classes.,True;False,FALSE,SA_P1_M1_Ch07_Pg096_1,SA_P1_M1_Q325
True/False,Structured code is a benefit of inheritance.,True;False,TRUE,SA_P1_M1_Ch07_Pg096_1,SA_P1_M1_Q326
Blanks,The class _______ defines the properties and methods common to all its derived classes.,,Person,SA_P1_M1_Ch07_Pg098_1,SA_P1_M1_Q327
Blanks,The method _______ is used to access the methods and properties of the parent class from the child class.,,super(),SA_P1_M1_Ch07_Pg098_1,SA_P1_M1_Q328
Blanks,The child class _______ inherits all the properties and methods of the parent class.,,Student,SA_P1_M1_Ch07_Pg098_1,SA_P1_M1_Q329
Match,Inheritance,The child class that inherits the properties and methods of the parent class;A method used to access the properties and methods of the parent class from the child class;The parent class that defines common properties and methods for all its derived classes;A mechanism that allows a class to inherit the properties and methods of another class,A mechanism that allows a class to inherit the properties and methods of another class,SA_P1_M1_Ch07_Pg098_1,SA_P1_M1_Q330
Match,Person,The parent class that defines common properties and methods for all its derived classes;The child class that inherits the properties and methods of the parent class;A mechanism that allows a class to inherit the properties and methods of another class;A method used to access the properties and methods of the parent class from the child class,The parent class that defines common properties and methods for all its derived classes,SA_P1_M1_Ch07_Pg098_1,SA_P1_M1_Q331
Match,Student,The child class that inherits the properties and methods of the parent class;The parent class that defines common properties and methods for all its derived classes;A method used to access the properties and methods of the parent class from the child class;A mechanism that allows a class to inherit the properties and methods of another class,The child class that inherits the properties and methods of the parent class,SA_P1_M1_Ch07_Pg098_1,SA_P1_M1_Q332
Match,Super(),The child class that inherits the properties and methods of the parent class;A method used to access the properties and methods of the parent class from the child class;A mechanism that allows a class to inherit the properties and methods of another class;The parent class that defines common properties and methods for all its derived classes,A method used to access the properties and methods of the parent class from the child class,SA_P1_M1_Ch07_Pg098_1,SA_P1_M1_Q333
MCQ,Which of the following is the correct syntax to define a parent class in Python?,class parent:;define Parent():;class Parent:;create Parent():,class Parent:,SA_P1_M1_Ch07_Pg098_1,SA_P1_M1_Q334
MCQ,What is the purpose of the 'super()' function in inheritance?,To override methods from the parent class;To define the parent class;To inherit properties and methods from the parent class;To create a new instance of the parent class,To inherit properties and methods from the parent class,SA_P1_M1_Ch07_Pg098_1,SA_P1_M1_Q335
MCQ,Which of the following is a child class of the 'Person' class in the given Python code?,Person;Teacher;Employee;Student,Student,SA_P1_M1_Ch07_Pg098_1,SA_P1_M1_Q336
True/False,Inheritance is a mechanism that allows a class to inherit the properties and methods of multiple parent classes.,True;False,FALSE,SA_P1_M1_Ch07_Pg098_1,SA_P1_M1_Q337
True/False,The 'super()' function can only be used in the constructor of a child class.,True;False,FALSE,SA_P1_M1_Ch07_Pg098_1,SA_P1_M1_Q338
True/False,A child class can override methods inherited from its parent class.,True;False,TRUE,SA_P1_M1_Ch07_Pg098_1,SA_P1_M1_Q339
Blanks,"Files are named locations on disk to store related __________,",,information,SA_P1_M1_Ch08_Pg100_1,SA_P1_M1_Q340
Blanks,"File operations are as follows:,",,"* Open a file

* Read or write (perform operation)

* Close the file",SA_P1_M1_Ch08_Pg100_1,SA_P1_M1_Q341
Match,Files,"Read or write (perform operation);They serve as a permanent data storage device in non-volatile memory;We use open() function to open a file, which returns file descripter/reference",They serve as a permanent data storage device in non-volatile memory,SA_P1_M1_Ch08_Pg100_1,SA_P1_M1_Q342
Match,Open a file,"We use open() function to open a file, which returns file descripter/reference;They serve as a permanent data storage device in non-volatile memory;Read or write (perform operation)","We use open() function to open a file, which returns file descripter/reference",SA_P1_M1_Ch08_Pg100_1,SA_P1_M1_Q343
Match,Close the file,"Read or write (perform operation);We use open() function to open a file, which returns file descripter/reference;They serve as a permanent data storage device in non-volatile memory",Read or write (perform operation),SA_P1_M1_Ch08_Pg100_1,SA_P1_M1_Q344
MCQ,Which of the following is the correct syntax to open a file?,"file = open(‘myfile.txt’, ‘read’);open(‘myfile.txt’, ‘w’);file = openfile(‘myfile.txt’, ‘w’);openfile(‘myfile.txt’, ‘w’, [buffer])","file = open(‘myfile.txt’, ‘w’)",SA_P1_M1_Ch08_Pg100_1,SA_P1_M1_Q345
True/False,Files are temporary locations on disk to store related information,True;False,FALSE,SA_P1_M1_Ch08_Pg100_1,SA_P1_M1_Q346
True/False,The open() function returns the file reference,True;False,TRUE,SA_P1_M1_Ch08_Pg100_1,SA_P1_M1_Q347
Match,r,Opens a file for reading;Opens in text mode;Opens a file for appending at the end of the file without truncating it,Opens a file for reading,SA_P1_M1_Ch08_Pg103_1,SA_P1_M1_Q348
Match,w,Opens in text mode;Opens a file for reading;Opens a file for appending at the end of the file without truncating it,Opens a file for writing. Creates a new file if it does not exist or truncates the file if it exists.,SA_P1_M1_Ch08_Pg103_1,SA_P1_M1_Q349
Match,a,Opens a file for reading;Opens a file for appending at the end of the file without truncating it;Opens in text mode,Opens a file for appending at the end of the file without truncating it. Creates a new file if it does not exist.,SA_P1_M1_Ch08_Pg103_1,SA_P1_M1_Q350
Match,write(s),Reads and returns a list of lines from the file;Reads at most n characters from the file;Writes the string s to the file;Writes a list of lines to the file;Returns an integer that represents the current position of the file's object,Writes the string s to the file,SA_P1_M1_Ch08_Pg103_1,SA_P1_M1_Q351
Match,writelines(lines),Reads and returns a list of lines from the file;Writes the string s to the file;Returns an integer that represents the current position of the file's object;Reads at most n characters from the file;Writes a list of lines to the file,Writes a list of lines to the file,SA_P1_M1_Ch08_Pg103_1,SA_P1_M1_Q352
Match,read(n),Returns an integer that represents the current position of the file's object;Writes a list of lines to the file;Reads at most n characters from the file;Reads and returns a list of lines from the file;Writes the string s to the file,Reads at most n characters from the file,SA_P1_M1_Ch08_Pg103_1,SA_P1_M1_Q353
Match,readline(),Returns an integer that represents the current position of the file's object;Writes a list of lines to the file;Writes the string s to the file;Reads and returns a list of lines from the file;Reads at most n characters from the file,Reads and returns one line from the file,SA_P1_M1_Ch08_Pg103_1,SA_P1_M1_Q354
Match,readlines(),Reads at most n characters from the file;Writes the string s to the file;Reads and returns a list of lines from the file;Writes a list of lines to the file;Returns an integer that represents the current position of the file's object,Reads and returns a list of lines from the file,SA_P1_M1_Ch08_Pg103_1,SA_P1_M1_Q355
Blanks,The open() function opens a file in __________ mode by default.,,read,SA_P1_M1_Ch08_Pg105_1,SA_P1_M1_Q356
Blanks,The __________ method is used to write data to a file.,,write,SA_P1_M1_Ch08_Pg105_1,SA_P1_M1_Q357
Blanks,The __________ method is used to close a file.,,close,SA_P1_M1_Ch08_Pg105_1,SA_P1_M1_Q358
Blanks,The __________ method is used to read data from a file.,,read,SA_P1_M1_Ch08_Pg105_1,SA_P1_M1_Q359
Blanks,The __________ method is used to read all the lines of a file as a list.,,readlines,SA_P1_M1_Ch08_Pg105_1,SA_P1_M1_Q360
Match,open(),Reads data from a file.;Reads all the lines of a file as a list.;Writes data to a file.;Opens a file in read mode.;Closes a file.,Opens a file in read mode.,SA_P1_M1_Ch08_Pg105_1,SA_P1_M1_Q361
Match,write(),Opens a file in read mode.;Writes data to a file.;Closes a file.;Reads all the lines of a file as a list.;Reads data from a file.,Writes data to a file.,SA_P1_M1_Ch08_Pg105_1,SA_P1_M1_Q362
Match,close(),Reads all the lines of a file as a list.;Writes data to a file.;Reads data from a file.;Opens a file in read mode.;Closes a file.,Closes a file.,SA_P1_M1_Ch08_Pg105_1,SA_P1_M1_Q363
Match,read(),Opens a file in read mode.;Reads all the lines of a file as a list.;Reads data from a file.;Writes data to a file.;Closes a file.,Reads data from a file.,SA_P1_M1_Ch08_Pg105_1,SA_P1_M1_Q364
Match,readlines(),Opens a file in read mode.;Closes a file.;Reads all the lines of a file as a list.;Writes data to a file.;Reads data from a file.,Reads all the lines of a file as a list.,SA_P1_M1_Ch08_Pg105_1,SA_P1_M1_Q365
MCQ,Which of the following modes is used to open a file for writing?,r+;a;r;w,w,SA_P1_M1_Ch08_Pg105_1,SA_P1_M1_Q366
MCQ,Which of the following methods is used to flush the contents of a file to disk?,close();flush();read();write(),flush(),SA_P1_M1_Ch08_Pg105_1,SA_P1_M1_Q367
MCQ,Which of the following methods is used to read all the lines of a file as a list?,readlines();read();close();write(),readlines(),SA_P1_M1_Ch08_Pg105_1,SA_P1_M1_Q368
True/False,The open() function can be used to open a file in write mode.,True;False,TRUE,SA_P1_M1_Ch08_Pg105_1,SA_P1_M1_Q369
True/False,The write() method can be used to read data from a file.,True;False,FALSE,SA_P1_M1_Ch08_Pg105_1,SA_P1_M1_Q370
True/False,The close() method must be called before reading data from a file.,True;False,FALSE,SA_P1_M1_Ch08_Pg105_1,SA_P1_M1_Q371
True/False,The readlines() method returns a tuple of lines.,True;False,FALSE,SA_P1_M1_Ch08_Pg105_1,SA_P1_M1_Q372
Blanks,Errors that arise during runtime execution are termed as _________.,,exceptions,SA_P1_M1_Ch09_Pg108_1,SA_P1_M1_Q373
Blanks,The exception handling method involves the usage of _________.,,try-except-finally,SA_P1_M1_Ch09_Pg108_1,SA_P1_M1_Q374
Match,IndexError,Unable to perform an input or output operation;Failure to import a module;Division by zero;Attempting to perform a calculation with incorrect data types;Attempting to access an element outside the range of an array,Attempting to access an element outside the range of an array,SA_P1_M1_Ch09_Pg108_1,SA_P1_M1_Q375
Match,ImportError,Failure to import a module;Attempting to access an element outside the range of an array;Attempting to perform a calculation with incorrect data types;Unable to perform an input or output operation;Division by zero,Failure to import a module,SA_P1_M1_Ch09_Pg108_1,SA_P1_M1_Q376
Match,IOError,Division by zero;Unable to perform an input or output operation;Attempting to access an element outside the range of an array;Attempting to perform a calculation with incorrect data types;Failure to import a module,Unable to perform an input or output operation,SA_P1_M1_Ch09_Pg108_1,SA_P1_M1_Q377
Match,TypeError,Attempting to access an element outside the range of an array;Division by zero;Failure to import a module;Unable to perform an input or output operation;Attempting to perform a calculation with incorrect data types,Attempting to perform a calculation with incorrect data types,SA_P1_M1_Ch09_Pg108_1,SA_P1_M1_Q378
Match,ZeroDivisionError,Attempting to perform a calculation with incorrect data types;Failure to import a module;Division by zero;Attempting to access an element outside the range of an array;Unable to perform an input or output operation,Division by zero,SA_P1_M1_Ch09_Pg108_1,SA_P1_M1_Q379
MCQ,Which of the following is NOT a standard exception in Python?,ImportError;IndexError;ZeroDivisionError;TypeError;FileNotFoundError,FileNotFoundError,SA_P1_M1_Ch09_Pg108_1,SA_P1_M1_Q380
MCQ,Which clause is executed if an exception occurs during the execution of the try clause?,except;import;def;try;finally,except,SA_P1_M1_Ch09_Pg108_1,SA_P1_M1_Q381
True/False,All exceptions in Python are handled by the try-except-finally method.,True;False,TRUE,SA_P1_M1_Ch09_Pg108_1,SA_P1_M1_Q382
True/False,The finally block is mandatory in exception handling.,True;False,FALSE,SA_P1_M1_Ch09_Pg108_1,SA_P1_M1_Q383
Blanks,"Inside the 'try' block, the division operation is performed and the result is stored in the variable _____________",,c,SA_P1_M1_Ch09_Pg111_1,SA_P1_M1_Q384
Blanks,The 'except' block with 'ZeroDivisionError' exception is executed when the denominator is _____________,,0,SA_P1_M1_Ch09_Pg111_1,SA_P1_M1_Q385
Blanks,The 'finally' block is executed _____________ the occurrence of any exception or not,,regardless of,SA_P1_M1_Ch09_Pg111_1,SA_P1_M1_Q386
Match,Try-Except-Finally block,"A block that always executes, regardless of exceptions being raised.;An exception raised when division by zero is attempted.;A Python block that handles errors and executes code accordingly.",A Python block that handles errors and executes code accordingly.,SA_P1_M1_Ch09_Pg111_1,SA_P1_M1_Q387
Match,ZeroDivisionError,"A Python block that handles errors and executes code accordingly.;A block that always executes, regardless of exceptions being raised.;An exception raised when division by zero is attempted.",An exception raised when division by zero is attempted.,SA_P1_M1_Ch09_Pg111_1,SA_P1_M1_Q388
Match,finally block,"An exception raised when division by zero is attempted.;A Python block that handles errors and executes code accordingly.;A block that always executes, regardless of exceptions being raised.","A block that always executes, regardless of exceptions being raised.",SA_P1_M1_Ch09_Pg111_1,SA_P1_M1_Q389
MCQ,Which of the following is NOT a type of exception handled in the code snippet?,ArithmeticError;ZeroDivisionError;Exception,ArithmeticError,SA_P1_M1_Ch09_Pg111_1,SA_P1_M1_Q390
MCQ,"What is the output when the divider function is called with arguments (2, 2)?",0;a/b result in 0;1,a/b result in 0,SA_P1_M1_Ch09_Pg111_1,SA_P1_M1_Q391
True/False,The 'try' block is only executed if no exceptions occur.,True;False,FALSE,SA_P1_M1_Ch09_Pg111_1,SA_P1_M1_Q392
True/False,The 'except' block can handle multiple different types of exceptions.,True;False,TRUE,SA_P1_M1_Ch09_Pg111_1,SA_P1_M1_Q393
True/False,The 'finally' block is executed before any 'except' blocks.,True;False,FALSE,SA_P1_M1_Ch09_Pg111_1,SA_P1_M1_Q394
Blanks,A database is a collection of _____ into a meaningful format.,,['raw data'],SA_P1_M1_Ch10_Pg113_1,SA_P1_M1_Q395
Blanks,We use _____ software to manipulate databases.,,['RDBMS'],SA_P1_M1_Ch10_Pg113_1,SA_P1_M1_Q396
Match,MySQL,"A popular RDBMS owned by Oracle Corporation;A popular RDBMS owned by Microsoft;A very fast, multithreaded, multi-user, and robust database server","A very fast, multithreaded, multi-user, and robust database server",SA_P1_M1_Ch10_Pg113_1,SA_P1_M1_Q397
Match,Oracle,"A popular RDBMS owned by Oracle Corporation;A very fast, multithreaded, multi-user, and robust database server;A popular RDBMS owned by Microsoft",A popular RDBMS owned by Oracle Corporation,SA_P1_M1_Ch10_Pg113_1,SA_P1_M1_Q398
Match,MS SQL Server,"A popular RDBMS owned by Microsoft;A popular RDBMS owned by Oracle Corporation;A very fast, multithreaded, multi-user, and robust database server",A popular RDBMS owned by Microsoft,SA_P1_M1_Ch10_Pg113_1,SA_P1_M1_Q399
MCQ,Which of the following is NOT a feature of MySQL?,User-friendly;Multithreaded;Open source;Fast,['User-friendly'],SA_P1_M1_Ch10_Pg113_1,SA_P1_M1_Q400
MCQ,Which programming language is used to create and manipulate database objects in MySQL?,Python;Java;C++;SQL,['SQL'],SA_P1_M1_Ch10_Pg113_1,SA_P1_M1_Q401
True/False,Databases are only used to store raw data.,True;False,FALSE,SA_P1_M1_Ch10_Pg113_1,SA_P1_M1_Q402
True/False,SQL is a case sensitive language.,True;False,FALSE,SA_P1_M1_Ch10_Pg113_1,SA_P1_M1_Q403
Blanks,"To download the MySQL installer, visit the following URL:",,https://dev.mysql.com/downloads/installer/,SA_P1_M1_Ch10_Pg117_1,SA_P1_M1_Q404
Blanks,The installer file name is:,,mysql-installer-community-8.0.31.0.msi,SA_P1_M1_Ch10_Pg117_1,SA_P1_M1_Q405
Blanks,"To create a database, use the following command:",,Create database db1;,SA_P1_M1_Ch10_Pg117_1,SA_P1_M1_Q406
Blanks,"To display existing databases, use the command:",,Show databases;,SA_P1_M1_Ch10_Pg117_1,SA_P1_M1_Q407
Blanks,"To connect to a database, use the command:",,Use db1;,SA_P1_M1_Ch10_Pg117_1,SA_P1_M1_Q408
Blanks,"To remove a database, use the command:",,Drop database db1;,SA_P1_M1_Ch10_Pg117_1,SA_P1_M1_Q409
Blanks,The primary key of a table makes each row:,,unique,SA_P1_M1_Ch10_Pg117_1,SA_P1_M1_Q410
Match,MySQL,A logical structure within a database that stores data in the form of rows and columns.;A collection of columns that represent a specific entity.;A database management system used for storing and managing data.;A column that uniquely identifies each row in a table.;A collection of related data stored in a structured format.,A database management system used for storing and managing data.,SA_P1_M1_Ch10_Pg117_1,SA_P1_M1_Q411
Match,Database,A column that uniquely identifies each row in a table.;A collection of columns that represent a specific entity.;A database management system used for storing and managing data.;A logical structure within a database that stores data in the form of rows and columns.;A collection of related data stored in a structured format.,A collection of related data stored in a structured format.,SA_P1_M1_Ch10_Pg117_1,SA_P1_M1_Q412
Match,Table,A collection of columns that represent a specific entity.;A column that uniquely identifies each row in a table.;A logical structure within a database that stores data in the form of rows and columns.;A collection of related data stored in a structured format.;A database management system used for storing and managing data.,A logical structure within a database that stores data in the form of rows and columns.,SA_P1_M1_Ch10_Pg117_1,SA_P1_M1_Q413
Match,Column,A logical structure within a database that stores data in the form of rows and columns.;A database management system used for storing and managing data.;A collection of related data stored in a structured format.;A collection of columns that represent a specific entity.;A column that uniquely identifies each row in a table.,A collection of columns that represent a specific entity.,SA_P1_M1_Ch10_Pg117_1,SA_P1_M1_Q414
