Type,Question,Options,Answer,Chunk_ID,QA_ID
Match,Primary key,A database management system used for storing and managing data.;A logical structure within a database that stores data in the form of rows and columns.;A collection of related data stored in a structured format.;A collection of columns that represent a specific entity.;A column that uniquely identifies each row in a table.,A column that uniquely identifies each row in a table.,SA_P1_M1_Ch10_Pg117_1,SA_P1_M1_Q415
MCQ,Which of the following data types is used to store numeric values with a decimal point?,int;varchar;numeric;char,['numeric'],SA_P1_M1_Ch10_Pg117_1,SA_P1_M1_Q416
MCQ,What is the purpose of the NOT NULL constraint on a column?,To prevent null values in the column.;To set the default value of the column to null.;To allow null values in the column.;To make the column unique.,['To prevent null values in the column.'],SA_P1_M1_Ch10_Pg117_1,SA_P1_M1_Q417
MCQ,Which of the following commands is used to display existing databases?,Use database;Create database;Show databases;Drop database,['Show databases'],SA_P1_M1_Ch10_Pg117_1,SA_P1_M1_Q418
True/False,The MySQL installer offers advanced options for customizing the installation.,True;False,FALSE,SA_P1_M1_Ch10_Pg117_1,SA_P1_M1_Q419
True/False,A database can only contain one table.,True;False,FALSE,SA_P1_M1_Ch10_Pg117_1,SA_P1_M1_Q420
True/False,The primary key of a table can be a composite key.,True;False,FALSE,SA_P1_M1_Ch10_Pg117_1,SA_P1_M1_Q421
Blanks,The syntax to insert a row into a table is ____,,"insert into table_name values(column1_value, column2_value, ..., columnN_value)",SA_P1_M1_Ch10_Pg120_1,SA_P1_M1_Q422
Blanks,"To delete all rows from a table, the syntax is ____",,delete from table_name,SA_P1_M1_Ch10_Pg120_1,SA_P1_M1_Q423
Blanks,"To update rows in a table, the syntax is ____",,"update table_name set column1_name=column1_value, column2_name=column2_value, ..., columnN_name=columnN_value",SA_P1_M1_Ch10_Pg120_1,SA_P1_M1_Q424
Match,insert,modifying existing rows in a table;removing rows from a table;adding a new row to a table,adding a new row to a table,SA_P1_M1_Ch10_Pg120_1,SA_P1_M1_Q425
Match,delete,removing rows from a table;adding a new row to a table;modifying existing rows in a table,removing rows from a table,SA_P1_M1_Ch10_Pg120_1,SA_P1_M1_Q426
Match,update,modifying existing rows in a table;removing rows from a table;adding a new row to a table,modifying existing rows in a table,SA_P1_M1_Ch10_Pg120_1,SA_P1_M1_Q427
MCQ,Which of the following is the correct syntax to insert a row into a table with specified column names?,"insert into table_name(column1_name, column2_name, ..., columnN_name) values(column1_value, column2_value, ..., columnN_value);insert into table_name values(column1_value, column2_value, ..., columnN_value);insert into table_name(column1_name, column2_name, ..., columnN_name) values(column1_value, column2_value);insert into table_name(column1_name, column2_name, ..., columnN_name) value(column1_value, column2_value, ..., columnN_value)","insert into table_name(column1_name, column2_name, ..., columnN_name) values(column1_value, column2_value, ..., columnN_value)",SA_P1_M1_Ch10_Pg120_1,SA_P1_M1_Q428
MCQ,Which of the following is the correct syntax to delete all rows from a table?,drop table table_name;delete * from table_name;delete from table_name where condition;delete from table_name,delete from table_name,SA_P1_M1_Ch10_Pg120_1,SA_P1_M1_Q429
MCQ,Which of the following is the correct syntax to update a row in a table?,"update table_name set (column1_name, column2_name, ..., columnN_name)=(column1_value, column2_value, ..., columnN_value);update table_name set column1_name=column1_value, column2_name=column2_value, ..., columnN_name=columnN_value;update table_name set column1_name=column1_value, column2_name=column2_value, ..., columnN_name=columnN_value where condition;update table_name(column1_name, column2_name, ..., columnN_name) values(column1_value, column2_value, ..., columnN_value)","update table_name set column1_name=column1_value, column2_name=column2_value, ..., columnN_name=columnN_value",SA_P1_M1_Ch10_Pg120_1,SA_P1_M1_Q430
True/False,The where clause is required to delete rows from a table.,True;False,FALSE,SA_P1_M1_Ch10_Pg120_1,SA_P1_M1_Q431
True/False,The where clause is required to update rows in a table.,True;False,FALSE,SA_P1_M1_Ch10_Pg120_1,SA_P1_M1_Q432
True/False,It is possible to insert rows into a table without specifying column names.,True;False,TRUE,SA_P1_M1_Ch10_Pg120_1,SA_P1_M1_Q433
True/False,The delete command can be used to remove specific rows from a table.,True;False,TRUE,SA_P1_M1_Ch10_Pg120_1,SA_P1_M1_Q434
Blanks,The asterisk (*) in a SQL statement means __________.,,['all columns'],SA_P1_M1_Ch10_Pg123_1,SA_P1_M1_Q435
Match,count(),Returns the maximum value in a column;Returns the minimum value in a column;Returns the sum of all values in a column;Returns the number of rows in a table;Returns the average value in a column,Returns the number of rows in a table,SA_P1_M1_Ch10_Pg123_1,SA_P1_M1_Q436
Match,max(),Returns the minimum value in a column;Returns the maximum value in a column;Returns the number of rows in a table;Returns the sum of all values in a column;Returns the average value in a column,Returns the maximum value in a column,SA_P1_M1_Ch10_Pg123_1,SA_P1_M1_Q437
Match,min(),Returns the average value in a column;Returns the sum of all values in a column;Returns the minimum value in a column;Returns the maximum value in a column;Returns the number of rows in a table,Returns the minimum value in a column,SA_P1_M1_Ch10_Pg123_1,SA_P1_M1_Q438
Match,sum(),Returns the average value in a column;Returns the minimum value in a column;Returns the sum of all values in a column;Returns the maximum value in a column;Returns the number of rows in a table,Returns the sum of all values in a column,SA_P1_M1_Ch10_Pg123_1,SA_P1_M1_Q439
Match,avg(),Returns the sum of all values in a column;Returns the number of rows in a table;Returns the minimum value in a column;Returns the average value in a column;Returns the maximum value in a column,Returns the average value in a column,SA_P1_M1_Ch10_Pg123_1,SA_P1_M1_Q440
MCQ,Which of the following SQL statements retrieves all rows in a table named 'product' in ascending order by the 'price' column?,"select pname, price from product where pid = 1000;;select * from product order by price;;select * from product order by price desc;;select * from product where price > 1000;",['select * from product order by price;'],SA_P1_M1_Ch10_Pg123_1,SA_P1_M1_Q441
True/False,The 'where' clause in a SQL statement is used to filter rows based on a condition.,True;False,TRUE,SA_P1_M1_Ch10_Pg123_1,SA_P1_M1_Q442
Blanks,_____ performs operations on groups.,,Group by,SA_P1_M1_Ch10_Pg126_1,SA_P1_M1_Q443
Blanks,"To connect to a database from Python, we need a _____ (simply api/library).",,database driver,SA_P1_M1_Ch10_Pg126_1,SA_P1_M1_Q444
Blanks,Database driver is _____ to the database.,,specific,SA_P1_M1_Ch10_Pg126_1,SA_P1_M1_Q445
Blanks,"To connect to MySQL from Python, we need to install the _____ driver using pip.",,mysql-connector-python,SA_P1_M1_Ch10_Pg126_1,SA_P1_M1_Q446
Match,Group by,Performs operations on groups of data;Software that acts as an interface between Python and a database;Package manager for Python;A library that allows Python to connect to MySQL,Performs operations on groups of data,SA_P1_M1_Ch10_Pg126_1,SA_P1_M1_Q447
Match,Database driver,Performs operations on groups of data;Software that acts as an interface between Python and a database;Package manager for Python;A library that allows Python to connect to MySQL,Software that acts as an interface between Python and a database,SA_P1_M1_Ch10_Pg126_1,SA_P1_M1_Q448
Match,pip,Performs operations on groups of data;A library that allows Python to connect to MySQL;Package manager for Python;Software that acts as an interface between Python and a database,Package manager for Python,SA_P1_M1_Ch10_Pg126_1,SA_P1_M1_Q449
Match,Connector,A library that allows Python to connect to MySQL;Package manager for Python;Software that acts as an interface between Python and a database;Performs operations on groups of data,A library that allows Python to connect to MySQL,SA_P1_M1_Ch10_Pg126_1,SA_P1_M1_Q450
MCQ,Which of the following is used to install the MySQL driver for Python?,rpm;pip;yum;apt-get,pip,SA_P1_M1_Ch10_Pg126_1,SA_P1_M1_Q451
MCQ,True or False: Group By can only be used on one column.,True;False,FALSE,SA_P1_M1_Ch10_Pg126_1,SA_P1_M1_Q452
True/False,Python can only connect to MySQL databases.,True;False,FALSE,SA_P1_M1_Ch10_Pg126_1,SA_P1_M1_Q453
True/False,"To use Group By, the data must be sorted.",True;False,TRUE,SA_P1_M1_Ch10_Pg126_1,SA_P1_M1_Q454
Blanks,"To get a reference to the test database, we use the ________ method.",,mysql.connector.connect,SA_P1_M1_Ch10_Pg128_1,SA_P1_M1_Q455
Blanks,"To execute SQL statements, we create a ________ object.",,cursor,SA_P1_M1_Ch10_Pg128_1,SA_P1_M1_Q456
Blanks,The ________ method is used to commit changes made to database tables permanently.,,db.commit(),SA_P1_M1_Ch10_Pg128_1,SA_P1_M1_Q457
Match,cursor,Commits changes made to database tables permanently;Used to execute SQL statements;Holds the SQL statement to be executed,Used to execute SQL statements,SA_P1_M1_Ch10_Pg128_1,SA_P1_M1_Q458
Match,sql_statement,Commits changes made to database tables permanently;Holds the SQL statement to be executed;Used to execute SQL statements,Holds the SQL statement to be executed,SA_P1_M1_Ch10_Pg128_1,SA_P1_M1_Q459
Match,db.commit(),Used to execute SQL statements;Holds the SQL statement to be executed;Commits changes made to database tables permanently,Commits changes made to database tables permanently,SA_P1_M1_Ch10_Pg128_1,SA_P1_M1_Q460
MCQ,Which of the following methods is used to get the connection to a MySQL database?,mysql.connector.connect;mysql.connect;cursor.connect,mysql.connector.connect,SA_P1_M1_Ch10_Pg128_1,SA_P1_M1_Q461
MCQ,Which of the following is not an SQL command?,insert;commit;create table,commit,SA_P1_M1_Ch10_Pg128_1,SA_P1_M1_Q462
True/False,The cursor object is used to execute SQL statements.,True;False,TRUE,SA_P1_M1_Ch10_Pg128_1,SA_P1_M1_Q463
True/False,Changes made to database tables are automatically committed by default.,True;False,FALSE,SA_P1_M1_Ch10_Pg128_1,SA_P1_M1_Q464
Blanks,"In Python, the ______ method is used to execute a SQL statement.",,execute,SA_P1_M1_Ch10_Pg131_1,SA_P1_M1_Q465
Blanks,"The ______ method returns a list of tuples, where each tuple contains the column values of a row.",,fetchall,SA_P1_M1_Ch10_Pg131_1,SA_P1_M1_Q466
Match,Cursor,A SQL statement that retrieves data from a table.;A single record in a database table.;A handle to a database table.,A handle to a database table.,SA_P1_M1_Ch10_Pg131_1,SA_P1_M1_Q467
Match,Select statement,A handle to a database table.;A single record in a database table.;A SQL statement that retrieves data from a table.,A SQL statement that retrieves data from a table.,SA_P1_M1_Ch10_Pg131_1,SA_P1_M1_Q468
Match,Row,A SQL statement that retrieves data from a table.;A single record in a database table.;A handle to a database table.,A single record in a database table.,SA_P1_M1_Ch10_Pg131_1,SA_P1_M1_Q469
MCQ,Which of the following methods is not used to connect to a MySQL database from Python?,cursor();connect();execute();fetchall(),fetchall(),SA_P1_M1_Ch10_Pg131_1,SA_P1_M1_Q470
MCQ,What is the purpose of the 'select *' clause in a SQL statement?,To update data in a table.;To insert data into a table.;To retrieve all columns from a table.;To retrieve specific columns from a table.,To retrieve all columns from a table.,SA_P1_M1_Ch10_Pg131_1,SA_P1_M1_Q471
True/False,"The fetchall() method returns a list of rows, where each row is represented as a tuple.",True;False,TRUE,SA_P1_M1_Ch10_Pg131_1,SA_P1_M1_Q472
True/False,The execute() method is used to close a database connection.,True;False,FALSE,SA_P1_M1_Ch10_Pg131_1,SA_P1_M1_Q473
